Document_ID,Design_Input,Risk_Assessment,Last_Reviewed,Compliance_Score,Critical_Issues,Composite_Compliance_Score
121843,"GE Healthcare has recently become aware of a potential safety issue involving unresponsive buttons on the display of the Engstrm ventilator and the Aespire View, Aisys, and Avance anesthesia machines.

As a result of a manufacturing issue, the buttons on the left, right, and bottom keypads may not always detect button presses. This may result in the inability to access certain menu functions wh",Low,2013-08-28,76.39,0,66.834
130227,GE Healthcare has become aware of a potential safety issue involving missing screws used for mounting the overhead Video Monitor to the tray assembly on a single monitor suspension. This issue affects the Precision 500D X-ray imaging systems.,Low,2014-09-05,40.55,0,45.33
149532,"The infant performance test did not meet the test specification for the Infant Head Uniformity test with High Resolution.  As a result, when the user performs High Resolution head scans, the reconstructed images may exhibit degraded image quality manifested as non-uniformity of the image, CT number shift greater than 5 Hounsfield units, and reduction in gray/white matter differentiation.  The issue is most sever in the High Resolution mode, and the factory reference pediatric scan protocols are set to High Resolution default.  Adults head scans have a factory reference protocol that defaults to standard resolution which doesn't experience the issue.",Low,2016-08-24,46.09,0,48.653999999999996
157860,FDA determined that a 510(k) is needed for the Vault Mapping software (also known as Lens Fitting).,Low,2017-07-27,79.81,0,68.886
166209,"The ABL90 FLEX can aspirate Cal 2 solution instead of rinse solution, when the following take place:
 The analyzer is in ready mode
 Operator lifts the inlet and then closes it again, thereby initiating a rinse
 Immediately after lifts the inlet and quickly closes it again",Low,2018-05-25,40.3,0,45.17999999999999
173478,The incorrect device was packaged in the vial.,Low,2018-08-07,49.65,0,50.79
183236,"The surgical suture is non-sterile. Use could compromise the sterile field, increase risk of a surgical site infection, and increase break strength retention.",Low,2020-08-03,72.92,0,64.75200000000001
189109,"Ultrasound gels and lotions manufactured by Eco-Med Pharmaceutical, Inc. may contain bacterial contamination. On August 18, 2021, FDA published a Letter to Health Care Providers to further address this issue: https://www.fda.gov/medical-devices/letters-health-care-providers/stop-using-all-eco-med-ultrasound-gels-and-lotions-due-risk-bacterial-contamination-letter-health.",Medium,2021-09-07,81.51,1,59.906
195692,"Device label display an incorrect expiration date, extends the shelf life of the product. Affected product  distributed in the United States from 3/25/2018 to 9/28/2020, expiration dates between 2022-11-01 and 2025-09-01 (Devices have a lot number ending in R, or are kits containing at least 1 device with a lot number ending in R.)",Medium,2022-07-29,79.12,0,59.472
202572,Stryker Neurovascular has observed that certain lots of Guider Softip XF Guide Catheters appear to have the incorrect tip curve shape. The impacted products were distributed with a tip curve shape which differs from the labeled tip curve shape.,Medium,2023-07-27,53.46,0,44.076
209943,Certain CADD Medication Cassette Reservoirs may exhibit a weakened weld joint between the medication bag and tubing due to a production equipment malfunction. This could result in a medication leakage.,Medium,2024-06-26,82.73,0,61.638
27445,Reports of broken plug ground pins on AC power cords for patient monitors.,Low,2003-04-30,54.23,0,53.538
35098,Several complaints of pumps exhibiting A47 alarms were received.  Investigation revealed the alarms occurred when the pump attempted to display text that exceeded the maximum display length of the pump screen. The investigation revealed this only occurs when the pump is programmed to display information in Spanish.,Low,2004-09-14,59.52,0,56.712
38862,Stryker was made aware that the short arm of  the bone inserter may fracture during use and potentially result in an adverse health consequence.,Low,2005-04-04,84.79,0,71.874
48344,Tibial punches were not manufactured to specification and could break at the tip during use.,Low,2006-08-29,78.98,0,68.388
55294,Marketed a regulated product without a 510(k).,Low,2007-08-17,90.95,0,75.57
71821,"Some of the labels are glossy, resulting in the bar code being difficult to read by the bar code reader.",Low,2008-06-11,79.46,0,68.67599999999999
84200,Fire/Shock hazard-- A component used in the device may cause sparks/flashes and poses a fire and shock hazard.,Low,2009-08-11,74.1,0,65.46
94382,Tubing packs may contain defective 1/2 inch x 1/2 inch tubing connectors. Leaks at the shank of the connector may result in air aspiration in the venous line.,Low,2010-09-07,45.62,1,47.372
104077,Hospira has received reports of continuous recycling and/or rebooting of Plum A+ infusion pumps when the backlight intensity and/or display contrast settings for the LED display has been adjusted from the original default setting.  This condition could cause a delay in therapy if the clinician is unable to start the device due to the continuous recycling and/or rebooting.,Low,2011-09-16,62.06,0,58.236
112615,"HeartStart XL Defibrillator/Monitor (M4735A) used on a patient when AC power is not in use, with a battery that may fail, the device may shut down unexpectedly without providing the user with a low battery warning message or audible tone.",Low,2012-09-11,55.91,0,54.546
120751,"Siemens determined that if an autosampler rack jam error occurs during operation of an ADVIA 2120/2120i connected to an ADVIA Autoslide, it is possible that the next slide processed by the Autoslide could be labeled with the wrong sample identification information.",Low,2013-08-12,54.64,0,53.784
129616,"Nemschoff Chairs, Inc. is recalling various model of the Serenity Treatment Chair  because of potential elevated temperatures in the seat and back lumbar areas of the chair.",Low,2011-01-18,98.38,0,80.02799999999999
149533,"The infant performance test did not meet the test specification for the Infant Head Uniformity test with High Resolution.  As a result, when the user performs High Resolution head scans, the reconstructed images may exhibit degraded image quality manifested as non-uniformity of the image, CT number shift greater than 5 Hounsfield units, and reduction in gray/white matter differentiation.  The issue is most sever in the High Resolution mode, and the factory reference pediatric scan protocols are set to High Resolution default.  Adults head scans have a factory reference protocol that defaults to standard resolution which doesn't experience the issue.",Low,2016-08-24,63.59,0,59.154
157991,There is a potential to generate falsely-depressed patient results in the cuvettes adjacent to the detached segment post for any assay run on the c4000 instrument.,Low,2015-01-15,93.52,0,77.112
165749,Sterility failure found in one of the units in the lot.,Low,2018-01-11,77.87,1,66.72200000000001
175202,"The affected lots may be packaged in syringes which include an incorrect bung.  The incorrect bung is made of a latex-free isoprene rubber material.  After prolonged storage and exposure to contained solutions, the rubber bung may degrade due to chemical interaction with the bleach solution.",Low,2019-06-27,87.69,0,73.614
183405,"The surgical suture is non-sterile. Use could compromise the sterile field, increase risk of a surgical site infection, and increase break strength retention.",Low,2020-08-03,70.16,0,63.096
188854,The devices malfunction under specific operator workflows.,Medium,2021-09-03,74.61,0,56.766
195693,"Device label display an incorrect expiration date, extends the shelf life of the product. Affected product  distributed in the United States from 3/25/2018 to 9/28/2020, expiration dates between 2022-11-01 and 2025-09-01 (Devices have a lot number ending in R, or are kits containing at least 1 device with a lot number ending in R.)",Medium,2022-07-29,69.55,0,53.73
202573,Stryker Neurovascular has observed that certain lots of Guider Softip XF Guide Catheters appear to have the incorrect tip curve shape. The impacted products were distributed with a tip curve shape which differs from the labeled tip curve shape.,Medium,2023-07-27,51.71,0,43.025999999999996
209944,Certain CADD Medication Cassette Reservoirs may exhibit a weakened weld joint between the medication bag and tubing due to a production equipment malfunction. This could result in a medication leakage.,Medium,2024-06-26,83.35,0,62.01
27322,"Incorrect results, without a data flag, reported if one of the other reagent containers becomes depleted before the R1 reagent is depleted.",Low,2003-05-08,56.85,0,55.11
34918,"GE Healthcare received reports of intermittent low ejection fraction (EF) results for MUGA (multi-gated acquisitions) studies on Millennium VG systems.  This issue can occasionally lead to distortions in the volume curve in some MUGA studies, and result in calculated EF values lower (never higher) than actual values.  A low EF value could lead to a physician decision to stop needed treatment.",Low,2004-09-03,41.46,0,45.876000000000005
40870,"Upon evaluation, the firm found that the fatigue strength of these nails was below the required value as specified in the design specification.",Low,2005-06-24,78.73,0,68.238
48367,The end label on the outer box was mislabeled on 9 of a 10 unit lot. The end label says ''22 mm'' and the implants are actually ''20 mm''. The main label on the cardboard box applied by the contract packager is correct in identifying the product as ''20 mm''.,Low,2006-02-27,50.63,0,51.378
55299,Complaints received of rust on the blades of BD Bard-Parker Surgical blades.,Low,2007-08-10,96.43,0,78.858
71822,"Some of the labels are glossy, resulting in the bar code being difficult to read by the bar code reader.",Low,2008-06-11,97.24,0,79.344
84763,Fire/Shock hazard-- A component used in the device may cause sparks/flashes and poses a fire and shock hazard.,Low,2009-08-11,94.89,0,77.934
93207,"When a patient is selected in the patient list and examination tab pressed with background query running at the same time, the wrong patient may be selected.",Low,2008-08-15,62.21,0,58.326
104047,"On 09/18/2011, Biomet Microfixation, Jacksonville, FL, recalled their SP-2411, Rubber Band, Lot 307850 because it was labeled and sold as ""LATEX FREE"" although it contains ""LATEX"". The firm's HHE identified this as a potential high health risk to the patients or end users with latex allergies.",Low,2011-08-18,40.93,0,45.558
112399,"Baxter has determined that the ball-valve feature of the Buretrol Solution Sets may not function as expected, allowing air to flow past the valve and into the tubing at the completion of dose within the burette.",Low,2012-09-07,95.7,0,78.42
121932,"GE Healthcare has recently become aware of a potential safety issue involving the spotfilm device power assist handle.

There is a potential for the internal bolts on the power assist handle to be loose or to loosen and/or fall out. This issue, if present, can result in a loss of calibration and offset of the power assist handle and/or, under extreme condition, sticking of the handle in the ON p",Low,2013-08-30,65.69,0,60.413999999999994
130146,The affected lots could have NBF concentrations that are lower or higher than the desired specifications.,Low,2014-09-17,98.0,0,79.8
149535,"The infant performance test did not meet the test specification for the Infant Head Uniformity test with High Resolution.  As a result, when the user performs High Resolution head scans, the reconstructed images may exhibit degraded image quality manifested as non-uniformity of the image, CT number shift greater than 5 Hounsfield units, and reduction in gray/white matter differentiation.  The issue is most sever in the High Resolution mode, and the factory reference pediatric scan protocols are set to High Resolution default.  Adults head scans have a factory reference protocol that defaults to standard resolution which doesn't experience the issue.",Low,2016-08-24,97.82,0,79.692
158813,"During an examination images were displayed on the live monitor,but the images were not displayed on the system monitor nor were they saved to the hard disk.",Low,2017-09-12,91.18,0,75.708
167190,The Equinoxe Reverse Drill Bit Kits may contain two 2mm diameter drill bits instead of one 2mm diameter drill bit and one 3.2mm diameter drill bit as intended.,Medium,2018-08-21,57.67,0,46.602
175272,"The affected lots may be packaged in syringes which include an incorrect bung.  The incorrect bung is made of a latex-free isoprene rubber material.  After prolonged storage and exposure to contained solutions, the rubber bung may degrade due to chemical interaction with the bleach solution.",Low,2019-06-27,63.11,0,58.866
183406,"The surgical suture is non-sterile. Use could compromise the sterile field, increase risk of a surgical site infection, and increase break strength retention.",Low,2020-08-03,91.07,0,75.642
189064,A software anomaly exists in the Centricity Universal Viewer study management feature in which study changes are not propagated to either the Centricity Enterprise Archive (EA) or another Vendor Neutral Archive (VNA).,Low,2021-08-12,59.02,0,56.412
195694,"Device label display an incorrect expiration date, extends the shelf life of the product. Affected product  distributed in the United States from 3/25/2018 to 9/28/2020, expiration dates between 2022-11-01 and 2025-09-01 (Devices have a lot number ending in R, or are kits containing at least 1 device with a lot number ending in R.)",Medium,2022-07-29,50.17,0,42.102000000000004
202574,Stryker Neurovascular has observed that certain lots of Guider Softip XF Guide Catheters appear to have the incorrect tip curve shape. The impacted products were distributed with a tip curve shape which differs from the labeled tip curve shape.,Medium,2023-07-27,73.41,0,56.046
209945,Certain CADD Medication Cassette Reservoirs may exhibit a weakened weld joint between the medication bag and tubing due to a production equipment malfunction. This could result in a medication leakage.,Medium,2024-06-26,96.17,0,69.702
27422,Instructions for use contained incorrect sensor reference.,Low,2000-11-16,81.76,0,70.05600000000001
33962,Mislabeled as to size; 1.55 mm pins are labeled as 2mm.,Low,2004-07-07,74.2,0,65.52000000000001
41024,Did not meet specifications.,Low,2005-08-03,45.83,0,48.498
50795,"A potential anomaly was identified on the CT subsytem, which could result in the radiation dose being different than the calculated dose reported to the operator.",Low,2006-11-06,76.9,0,67.14
55336,Complaints received of rust on the blades of BD Bard-Parker Surgical blades.,Low,2007-08-10,99.4,0,80.64
72501,Potential for tubing fracture near the tip of the catheter.,Low,2008-06-23,48.41,0,50.04599999999999
84764,Fire/Shock hazard-- A component used in the device may cause sparks/flashes and poses a fire and shock hazard.,Low,2009-08-11,71.1,0,63.66
92444,Firm discovered that some of their straight broach handles are experiencing early failure due to a weakened handle locking mechanism (Leaf Spring).,Low,2010-06-15,92.64,1,75.584
104065,Post-operative kits 57 mm may contain 70 mm pouches.,Low,2011-06-22,84.45,0,71.67
112401,"Baxter has determined that the ball-valve feature of the Buretrol Solution Sets may not function as expected, allowing air to flow past the valve and into the tubing at the completion of dose within the burette.",Low,2012-09-07,81.82,0,70.09199999999998
121957,There are artifacts appearing on the Tracker images during threshold-triggered bolus scans with protocols using a Rotation Time of 0.4 seconds.,Low,2013-08-30,82.15,0,70.28999999999999
130167,The affected lots could have NBF concentrations that are lower or higher than the desired specifications.,Low,2014-09-17,61.57,0,57.942
139351,"If two specific operations are performed in multi-phase helical scanning, the acquired raw data may not be saved.",Low,2015-05-08,57.62,0,55.571999999999996
149426,Siemens became aware of a potential issue with the patient table for Ysio Max and Multix Fusion systems.  There is an unlikely risk that an internal part of the table may detach causing the table top to tilt to the left side which could result in an injury to a patient on the table.,Low,2016-08-01,88.56,1,73.136
158653,"During internal cycle testing of A-Series lifts Handicare has found that the A-Series lift strap for lifts manufactured between April 25, 2017 and June 12, 2017 may wear prematurely at max load (625 lbs). We have identified the root cause as a supplied component that was not to specification. If the strap wears during use there is a potential risk for the person being supported by the lift to drop.",Low,2017-09-08,88.61,0,74.166
166988,Potential for product sterility breach due to a compromised or pinched seal defect,Low,2018-08-01,92.02,1,75.21199999999999
175276,"The affected lots may be packaged in syringes which include an incorrect bung.  The incorrect bung is made of a latex-free isoprene rubber material.  After prolonged storage and exposure to contained solutions, the rubber bung may degrade due to chemical interaction with the bleach solution.",Low,2019-06-27,94.79,0,77.874
183407,"The surgical suture is non-sterile. Use could compromise the sterile field, increase risk of a surgical site infection, and increase break strength retention.",Low,2020-08-03,70.68,0,63.408
189019,"Some devices are outside tolerances and showed a maximal deviation of 2 degrees in the orientation between the peek head and titanium base, and an incongruence between the size engraved on the peek has been identified. Deviations may delay the final restoration.",Low,2021-07-26,70.09,0,63.054
195740,"Device label display an incorrect expiration date, extends the shelf life of the product. Affected product  distributed in the United States from 3/25/2018 to 9/28/2020, expiration dates between 2022-11-01 and 2025-09-01 (Devices have a lot number ending in R, or are kits containing at least 1 device with a lot number ending in R.)",Medium,2022-07-29,87.9,0,64.74000000000001
202575,Stryker Neurovascular has observed that certain lots of Guider Softip XF Guide Catheters appear to have the incorrect tip curve shape. The impacted products were distributed with a tip curve shape which differs from the labeled tip curve shape.,Medium,2023-07-27,79.0,0,59.4
209946,Certain CADD Medication Cassette Reservoirs may exhibit a weakened weld joint between the medication bag and tubing due to a production equipment malfunction. This could result in a medication leakage.,Medium,2024-06-26,82.12,0,61.272
27423,Instructions for use contained incorrect sensor reference.,Low,2000-11-16,87.75,0,73.65
34911,Mouse anti-TTF-1 had become contaminated by immunoglobulins from mouse serum that was co-eluted during purification leading to false readings.,Low,2004-04-06,93.4,0,77.03999999999999
42322,Did not meet specifications.,Low,2005-08-03,60.28,0,57.168
50798,"A potential anomaly was identified on the CT subsytem, which could result in the radiation dose being different than the calculated dose reported to the operator.",Low,2006-11-06,62.53,0,58.518
55355,Plates manufactured without vancomycin.  Possibility for false resistant results.,Low,2007-04-23,45.64,0,48.384
72537,"Docking screw/nut  failure, which may result in a treatment head dropping, potentially impacting the patient.",Low,2008-06-20,74.7,1,64.82
84765,Fire/Shock hazard-- A component used in the device may cause sparks/flashes and poses a fire and shock hazard.,Low,2009-08-11,42.16,0,46.29599999999999
74722,"Stryker Orthopaedics became aware that a box labeled as Duracon Total Knee Distal Femoral Locking Screws for 5 mm spacer, may actually contain a 10 mm screw.",Low,2006-10-05,67.94,0,61.763999999999996
104054,It is possible to load different patients in the record and verify (R&V) system and in the multilead control software (MCS).,Low,2011-05-25,72.56,0,64.536
112403,"Baxter has determined that the ball-valve feature of the Buretrol Solution Sets may not function as expected, allowing air to flow past the valve and into the tubing at the completion of dose within the burette.",Low,2012-09-07,57.19,0,55.314
121016,A post market safety review following several customer complaints indicated additional clarification was necessary in the Midfoot Fusion Bolt Technique Guide to reduce potential for bolt back-out or migration by emphasizing the need for supplemental fixation.,Low,2013-03-08,75.45,0,66.27000000000001
130169,The affected lots could have NBF concentrations that are lower or higher than the desired specifications.,Low,2014-09-17,41.83,0,46.098
139352,"If two specific operations are performed in multi-phase helical scanning, the acquired raw data may not be saved.",Low,2015-05-08,42.24,0,46.344
149427,Siemens became aware of a potential issue with the patient table for Ysio Max and Multix Fusion systems.  There is an unlikely risk that an internal part of the table may detach causing the table top to tilt to the left side which could result in an injury to a patient on the table.,Low,2016-08-01,89.36,1,73.616
158744,"A limited amount of Carina mobile lifts have been delivered with a too small locking pin. If a locking pin
smaller than the correct size is mounted on the Carina mobile lift, the locking pin is likely to cause
increased wear on the plastic bushings. In case of continued use, these components may cause wear on the metal of the piston rod eye.",Low,2016-07-28,61.61,0,57.966
166989,Potential for product sterility breach due to a compromised or pinched seal defect,Low,2018-08-01,47.62,1,48.572
175277,"The affected lots may be packaged in syringes which include an incorrect bung.  The incorrect bung is made of a latex-free isoprene rubber material.  After prolonged storage and exposure to contained solutions, the rubber bung may degrade due to chemical interaction with the bleach solution.",Low,2019-06-27,71.33,0,63.797999999999995
183408,"The surgical suture is non-sterile. Use could compromise the sterile field, increase risk of a surgical site infection, and increase break strength retention.",Low,2020-08-03,86.2,0,72.72
189020,"Some devices are outside tolerances and showed a maximal deviation of 2 degrees in the orientation between the peek head and titanium base, and an incongruence between the size engraved on the peek has been identified. Deviations may delay the final restoration.",Low,2021-07-26,52.95,0,52.769999999999996
195742,"Device label display an incorrect expiration date, extends the shelf life of the product. Affected product  distributed in the United States from 3/25/2018 to 9/28/2020, expiration dates between 2022-11-01 and 2025-09-01 (Devices have a lot number ending in R, or are kits containing at least 1 device with a lot number ending in R.)",Medium,2022-07-29,77.37,0,58.422000000000004
202576,Stryker Neurovascular has observed that certain lots of Guider Softip XF Guide Catheters appear to have the incorrect tip curve shape. The impacted products were distributed with a tip curve shape which differs from the labeled tip curve shape.,Medium,2023-07-27,45.12,0,39.072
209947,Certain CADD Medication Cassette Reservoirs may exhibit a weakened weld joint between the medication bag and tubing due to a production equipment malfunction. This could result in a medication leakage.,Medium,2024-06-26,43.1,0,37.86
27424,Instructions for use contained incorrect sensor reference.,Low,2000-11-16,71.88,0,64.12799999999999
34912,Mouse anti-TTF-1 had become contaminated by immunoglobulins from mouse serum that was co-eluted during purification leading to false readings.,Low,2004-04-06,72.44,0,64.464
42323,Did not meet specifications.,Low,2005-08-03,78.25,0,67.94999999999999
48062,During use an unexpected flaking of the inner surface coating (blood contact) that has the potential for risk of embolism.,Low,2004-01-26,83.57,0,71.142
55366,Method is susceptible to positive interference from endogenous ALT in patient samples.,Low,2007-07-24,98.55,0,80.13
72775,The latex free labor & delivery packs contain a latex Nuk pacifier.  The pacifier is packaged separately and offers no risk of exposure of latex particles to other components of the pack.,Low,2008-08-04,70.98,0,63.588
84766,Fire/Shock hazard-- A component used in the device may cause sparks/flashes and poses a fire and shock hazard.,Low,2009-08-11,59.38,0,56.628
92980,One box containing five catheters did not complete the sterilization process prior to distribution.,Low,2010-05-24,87.71,0,73.626
103871,"The firm manufactured kits containing a HCH device, manufactured by Vital Signs, that was subsequently recalled because the product may have an occlusion that could prevent proper flow of medical gases or oxygen to the patient.",Low,2011-08-23,56.25,0,54.75
112404,"Baxter has determined that the ball-valve feature of the Buretrol Solution Sets may not function as expected, allowing air to flow past the valve and into the tubing at the completion of dose within the burette.",Low,2012-09-07,66.34,0,60.804
121955,"Sekisuki Diagnostics has issued a Product Correction for certain lot numbers of the OSOM C. difficile Toxin A/B Test Kit, because it has been determined that there is potential for false negative results.",Low,2013-09-16,44.71,0,47.826
130170,The affected lots could have NBF concentrations that are lower or higher than the desired specifications.,Low,2014-09-17,41.52,0,45.912000000000006
139353,"If two specific operations are performed in multi-phase helical scanning, the acquired raw data may not be saved.",Low,2015-05-08,97.76,0,79.656
