Document_ID,Design_Input,Risk_Assessment,Last_Reviewed,Compliance_Score,Critical_Issues,Composite_Compliance_Score
130372,"Two malfunctions posing potential risk to patients were identified with Siemens Ysio Max, AXIOM Luminos dRF Max, Uroskop Omnia Max, and Luminos Agile Max systems with a specific set of serial numbers that will cause lost images due to an automatic Radiology Information System (RIS) worklist update, thus causing examinations to be repeated. Image label may also be displayed incorrectly after images",Low,2014-09-02,46.47,0,48.882
138996,"It was found that if specific operations are performed in multi-phase helical scanning, the acquired raw data may not be saved due to a software problem.",Low,2015-05-08,41.89,0,46.134
146078,Loose connector ports in controller body.,Low,2016-06-08,78.18,0,67.908
158627,"There is a potential failure of the top plate assembly, which is the component that connects the seating system of the wheelchair to the base.",Low,2017-09-01,58.86,1,55.315999999999995
167279,Reports have been received of an anomaly that can result in a treatment without intended gating (respiratory tracking/monitoring). This issue occurs when a patient planned with gating is treated on more than one system.,Low,2018-08-20,70.51,0,63.306000000000004
176401,Potential for leaking product,Medium,2018-09-21,94.45,0,68.67
183099,The device staples may not properly form upon application preventing adequate hemostasis.  Use of a product with this assembly error may result in incomplete staple formation.,Medium,2020-08-12,54.96,0,44.976
189114,There is a potential for false positive results.,Low,2021-09-02,64.62,0,59.772
195698,"The outer label does not match the device inside the package. The affected lot of EVOLVE Proline Stem 7.5mm +2 contains a size 9.5mm +4 stem, while the affected lot of EVOLVE Proline Stem 9.5mm +4 contains a size 7.5mm +2 stem.",Medium,2022-08-03,85.33,0,63.198
202861,"There is a potential for blood backfill leakage
and foreign material.",Medium,2023-08-08,53.73,0,44.238
210103,There is a defect in the air-in-line software algorithm.,Medium,2024-09-13,44.62,1,37.772
29626,"The 400cc, 460cc, 500cc and 560cc sizes of the McGhan Style 40 Silicone-filled Breast Implants were manufactured using one size smaller shells than required.",Low,2003-09-12,57.39,0,55.434
34915,Assay may give elevated patients results.,Low,2004-08-24,49.67,0,50.802
41847,"Data from internal testing indicates that the Nichols Advantage Invasive Trophoblast Antigen Assay Cartridges (ITA)(Lot No 62-500261) and Hyperglycosylated Human Chorionic Gonadotropin Assay Cartridges (H-hCG)(Lot No 62-500262) does not maintain its stability over the 12 month expiration dating of the product, and that stability is assured only through 6 months.",Low,2005-08-31,95.78,0,78.46799999999999
48463,"A component of the device is a Dell laptop computer, which contains batteries that are under recall because they can overheat and cause a fire.",Low,2006-09-08,88.49,0,74.094
53847,Elevated inspired CO2 levels related to the use of the Datex-Ohmeda GE Healthcare Disposable Multi Absorber Canister with the EZchange Module.,Low,2007-07-24,78.0,0,67.8
71772,"Some of the labels are glossy, resulting in the bar code being difficult to read by the bar code reader.",Low,2008-06-11,92.29,0,76.374
82495,"The cup associated with these lots of product may have a pin-sized hole in the floor of the cup.  As a result, there is a potential  for affected lots of cups to leak urine after an extended period of time.",Low,2009-04-27,88.22,0,73.93199999999999
93083,"Under certain wireless network conditions a communication error can occur, which freezes the PC Unit screen, which may result in a delay of therapy.  A delay of therapy may result in serious injury and/or death. CareFusion identified this potential risk associated with the Alaris PC unit model 8015 only (PC Unit) manufactured between December-2008 and September-2009.",Low,2010-07-13,51.19,2,49.714
101368,An investigation was initiated based on a report from the field in which an Intensive Follow-up Indicator (IFI) message was unexpectedly received by a medical professional when using Model 250 version 8.0 software to interrogate a patient's Model 103 Generator.,Low,2011-05-06,93.55,0,77.13
112953,"When the outer catheter is either coiled or in a contorted configuration outside of the endoscope and the patient, and excessive force is applied to the handle, the jaws may become inoperable and may become stuck in the open condition.",Low,2011-11-14,72.36,0,64.416
121529,Medical device tubing used for endotracheal airway application may become weakened and rendered ineffective.,Low,2013-08-27,88.45,0,74.07
129364,"Some users of ENVOY 500 AST Reagent Kit, reference 55255, for Envoy 500 systems are observing that Quality Control (QC) fails before the product expiry is reached.",Low,2014-08-11,93.77,0,77.262
149075,Foreign material found within the driveline connector of the HVAD Pump that could cause increased impedance resulting in electrical faults.,Medium,2016-08-17,59.08,0,47.448
158632,"There is a potential failure of the top plate assembly, which is the component that connects the seating system of the wheelchair to the base.",Low,2017-09-01,46.6,1,47.96
166565,Endologix is notifying physicians of patient tailored surveillance recommendations as well as general warnings/precautions for interventions to or through an existing AFX device.  This is a follow-up notification to the one that was sent out in December 2016.  The updates are related to the observation of Type III endoleaks.,Low,2018-07-31,53.68,0,53.208
176402,Potential for leaking product,Medium,2018-09-21,65.63,0,51.37799999999999
183100,The device staples may not properly form upon application preventing adequate hemostasis.  Use of a product with this assembly error may result in incomplete staple formation.,Medium,2020-08-12,89.08,0,65.44800000000001
189115,There is a potential for false positive results.,Low,2021-09-02,91.64,0,75.98400000000001
195699,"The outer label does not match the device inside the package. The affected lot of EVOLVE Proline Stem 7.5mm +2 contains a size 9.5mm +4 stem, while the affected lot of EVOLVE Proline Stem 9.5mm +4 contains a size 7.5mm +2 stem.",Medium,2022-08-03,40.42,0,36.251999999999995
202862,"There is a potential for blood backfill leakage
and foreign material.",Medium,2023-08-08,70.64,0,54.384
209890,"Pressure sensitive adhesive hooks attached to the sides of the anterior cervical orthosis collar panel can occasionally exhibit poor adhesion, which may lead to them gradually peeling off with repeated doffing, possibly leading to reduced immobilization of the cervical spine.",Medium,2024-08-20,65.04,0,51.024
29148,Software defect.  Clinical Laboratory results failing quality assurance were filed directly to a patient's chart without review.,Low,2003-08-12,53.33,1,51.998
34917,The product does not demonstrate the expected prolonged thrombin times for specimens obtained from patients recieving heparin,Low,2004-07-21,47.19,0,49.31399999999999
41850,"Data from internal testing indicates that the Nichols Advantage Invasive Trophoblast Antigen Assay Cartridges (ITA)(Lot No 62-500261) and Hyperglycosylated Human Chorionic Gonadotropin Assay Cartridges (H-hCG)(Lot No 62-500262) does not maintain its stability over the 12 month expiration dating of the product, and that stability is assured only through 6 months.",Low,2005-08-31,60.26,0,57.156
48464,"A component of the device is a Dell laptop computer, which contains batteries that are under recall because they can overheat and cause a fire.",Low,2006-09-08,96.57,0,78.942
53853,Firm discovered that a deterioration value of approximately 20% was found when the product of this lot was measured.  Tosoh AIA confirmed that deterioration of the product occurred over time and resulted in a deviation from the assigned value.,Low,2007-06-22,59.39,0,56.634
71817,"Some of the labels are glossy, resulting in the bar code being difficult to read by the bar code reader.",Low,2008-06-11,71.13,0,63.678
82496,"The cup associated with these lots of product may have a pin-sized hole in the floor of the cup.  As a result, there is a potential  for affected lots of cups to leak urine after an extended period of time.",Low,2009-04-27,82.18,0,70.30799999999999
87691,It was discovered that the operator console did not have a label affixed in accordance with 21CFR 1010.2 indicating certification to applicable performance standards.,Low,2009-05-01,61.82,0,58.092
103856,The Outlook ES Dose Guard Care Area can inadvertently be exited when the pump enters the KVO (Keep Vein Open) state.  The same condition can occur when a sequence of HOLD-HOLD key strokes are performed on the pump key panel.,Low,2010-07-20,98.31,0,79.98599999999999
112153,Invuity is notifying customers to return all obsolete BriteField Illuminated Suction Devices from the field. It has not been distributed since March 2011 as the next generation product was introduced at that time.,Low,2012-05-12,97.75,0,79.65
122212,Bard Peripheral Vascular is recalling specific lots of Bard Lifestent Solo Vascular Stent because they have determined a higher incidence rate of partial stent deployment associated with their use.,Low,2013-09-30,55.11,0,54.065999999999995
129618,"Ortho Clinical Diagnostics identified a potential for biased results to be generated when using VITROS PHYT Slides, Lot 2613-0150-4913.  Some positively biased results were identified during testing of a different VITROS PHYT Slide lot; the affected slides were not released for distribution.  Since Lot 2613-0150-4913 was manufactured in the same event, there is the potential for slides from this lot to also be affected.",Low,2014-08-20,69.83,0,62.897999999999996
149142,Baxter Healthcare Corporation is issuing a voluntary product recall for all unexpired lots of the 50mm 0.2 Micron Filter (Product Code: H93835) due to the potential for the filter membrane layer to be missing and for particulate matter to be present.,Low,2016-08-24,58.05,0,55.83
157875,The Swish Duo-Grip Healing Collar part number 9048-13H (4.8mm) package contained a 9037-13H (3.7 mm) component.,Low,2017-07-21,57.09,0,55.254
167115,Endologix is notifying physicians of patient tailored surveillance recommendations as well as general warnings/precautions for interventions to or through an existing AFX device.  This is a follow-up notification to the one that was sent out in December 2016.  The updates are related to the observation of Type III endoleaks.,Low,2018-07-31,42.21,0,46.326
176404,Potential for leaking product,Medium,2018-09-21,76.57,0,57.94199999999999
183101,The device staples may not properly form upon application preventing adequate hemostasis.  Use of a product with this assembly error may result in incomplete staple formation.,Medium,2020-08-12,70.16,0,54.096
189116,There is a potential for false positive results.,Low,2021-09-02,43.09,0,46.854
196076,"The outer sterile package cavity has a corner wall thickness that is below the specification. The thin corner wall could potentially crack during transit. Potential risks include non-clinically or clinically significant extension of surgery, or infection leading to surgical intervention.",Medium,2022-08-25,56.72,0,46.032
202863,"There is a potential for blood backfill leakage
and foreign material.",Medium,2023-08-08,94.5,0,68.69999999999999
209939,"The 866173 lntelliVue G7m Anesthesia Gas Modules could have a component issue that may trigger an interruption of the gas measurement. This issue concerns the G7m's sample gas pump which could stop working, producing a technical, INOP (inoperable) alarm. The pump may fail prematurely when there is friction caused by an abrasion. This recall is for an IMPORTANT PRODUCT NOTICE dated 1/18/23.",Medium,2023-01-18,54.37,0,44.622
29366,"Component spring or nut may loosen, detach, and fall into chest of patient during surgical procedure.",Low,2003-09-18,48.69,0,50.214
34967,"A customer complaint received indicated that a Protg stent, PN SERB65-09-30-120 was found in a pouch that was not properly sealed.  The Protg GPS Stent System is 'double barrier' packaged and consists of a sealed inner tray in a sealed pouch.  The pouch seal ensures sterility of the external surface of the inner tray.  The inner tray seal containing the device was not affected.",Low,2004-09-01,69.37,0,62.622
41876,Device has incorrect notation associated with therapeutic drug monitoring assays.,Low,2005-02-28,99.14,0,80.484
48465,"A component of the device is a Dell laptop computer, which contains batteries that are under recall because they can overheat and cause a fire.",Low,2006-09-08,54.52,0,53.712
54520,Sterility of device may be compromised due to breach in sterile barrier.,Low,2007-07-18,80.33,0,69.19800000000001
71818,"Some of the labels are glossy, resulting in the bar code being difficult to read by the bar code reader.",Low,2008-06-11,85.7,0,72.42
82497,"The cup associated with these lots of product may have a pin-sized hole in the floor of the cup.  As a result, there is a potential  for affected lots of cups to leak urine after an extended period of time.",Low,2009-04-27,54.26,0,53.556
94054,"Users may inadvertently leave a test plug in the inspiratory flow sensor after completing Low P Leak Check on the SCGO (Switched Common Gas Outlet) configuration of Avance, Amingo, and Aisys anesthesia machines that may impact patient safety.
If the test plug remains in place and therapy is initiated, the machine will not provide gas to the patient. This would inhibit mechanical or manual ventila",Low,2010-08-30,83.69,0,71.214
101895,Two of the Implant Driver Assembly tips were reported to break during surgery.,Low,2011-06-07,62.07,0,58.242
113109,The wrong electrical connector pin was attached to the cord during assembly by the manufacturer.  this electrical connector is too big to fit into the port on the foot activated generator.  this makes the device unusable.,Low,2012-09-06,77.94,0,67.764
121287,"During final testing of the Draeger Fabius GS Premium, Fabius OS, and Fabius Tiro anesthesia machines, some units did not pass the high voltage test and the minimum clearance between an electrical component and the unit housing was not maintained for some from a specific batch.",Low,2013-08-14,78.01,0,67.80600000000001
130205,"A failure of a specific component may prevent the ventilators from operating on AC power or transitioning back to AC power when operating on battery.  Additionally, if a battery is not present or is depleted the ventilators will not operate.  This failure will cause the loss of ventilator support, which may result in hypercarbia or hypoxemia.",Low,2014-09-17,72.15,1,63.28999999999999
148982,"A reagent stability issue (still under investigation) causes less separation in the calibration curve, which affects results across the entire range.  For controls, maximum bias of +/- 35% for low levels, +/- 33% for mid-range levels, and +/- 47% for high levels is observed.  Bias in patient samples ranges from -15.7% to +5.2% with an average bias of -5.6% when comparing the QMS everolimus assay to an everolimus LC-MS reference method.  Patient samples across the measuring range  sub-therapeutic, therapeutic, and supra-therapeutic  could be affected.",Low,2016-08-15,45.42,0,48.251999999999995
157858,FDA determined that a 510(k) is needed for the Vault Mapping software (also known as Lens Fitting).,Low,2017-07-27,90.12,0,75.072
167116,Endologix is notifying physicians of patient tailored surveillance recommendations as well as general warnings/precautions for interventions to or through an existing AFX device.  This is a follow-up notification to the one that was sent out in December 2016.  The updates are related to the observation of Type III endoleaks.,Low,2018-07-31,59.25,0,56.55
176406,Potential for leaking product,Medium,2018-09-21,51.19,0,42.714
183102,The device staples may not properly form upon application preventing adequate hemostasis.  Use of a product with this assembly error may result in incomplete staple formation.,Medium,2020-08-12,42.45,0,37.47
189118,There is a potential for false positive results.,Low,2021-09-02,75.45,0,66.27000000000001
196024,"Drill Pin (drill bit) is not compatible with the Drill Template included in the kit due to a packaging error,  result in a surgical delay and may cause soft tissue damage if a larger incision is required to accommodate an alternative form of fixation. Additionally, there is a potential for adverse tissue reaction if the surgeon attempts to use the guide regardless of tight fit and plastic debris is created and ends up in the wound",Medium,2022-08-30,80.65,0,60.39
202938,"Ortho Clinical Diagnostics (QuidelOrtho) confirmed certain Proboscis/Piston Assemblies manufactured between 07-Apr-2022 (Date code: 040722) and 19-Dec-2022 (Date code: 121922) may not perform as intended due to an out-of-specification barrel component. This may cause VITROS VersaTips and/or VITROS MicroTips to be improperly seated on the proboscis, which may result in falsely elevated Gentamicin and Valproic Acid assay results as well as an increased frequency of condition codes resulting in delayed patient results. The issue was identified by internal testing when reported instruments failed to pass release testing and were traced to the molded Proboscis part J56639 with date codes from 040722 onward.",Medium,2023-08-09,41.0,0,36.599999999999994
209940,The bulk product used in the recalling firm's repackaged finished product was recalled due to bacterial contamination.,Medium,2024-08-23,70.73,1,53.438
29022,possible movement of table tilt and table longitudinal,Low,2003-08-08,53.59,0,53.154
35052,Inadequate trocar tip assembly that might yeild parts to patients.,Low,2004-09-17,78.71,0,68.226
41904,"Synchron LX Systems Operating Software Version 4.5/v4.6 CBD (Chemistry Database) introduced an adjustment to the urine Uric Acid database calculation scheme which for some patients, depending on the volume of 24 hour urine sample, results may be reduced from above the upper limit of the laboratory's reference interval to below the limit.",Low,2005-09-06,50.46,0,51.275999999999996
48342,Tibial punches were not manufactured to specification and could break at the tip during use.,Low,2006-08-29,81.46,0,69.876
54604,"Angled Insert Impactor may scratch Tibial Insert on the articulating surface, causing increased wear at the damaged site.",Low,2007-08-09,63.2,0,58.92
71819,"Some of the labels are glossy, resulting in the bar code being difficult to read by the bar code reader.",Low,2008-06-11,96.2,0,78.72
82498,"The cup associated with these lots of product may have a pin-sized hole in the floor of the cup.  As a result, there is a potential  for affected lots of cups to leak urine after an extended period of time.",Low,2009-04-27,48.25,0,49.95
94055,"Users may inadvertently leave a test plug in the inspiratory flow sensor after completing Low P Leak Check on the SCGO (Switched Common Gas Outlet) configuration of Avance, Amingo, and Aisys anesthesia machines that may impact patient safety.
If the test plug remains in place and therapy is initiated, the machine will not provide gas to the patient. This would inhibit mechanical or manual ventila",Low,2010-08-30,60.46,0,57.275999999999996
104075,Hospira has received reports of continuous recycling and/or rebooting of Plum A+ infusion pumps when the backlight intensity and/or display contrast settings for the LED display has been adjusted from the original default setting.  This condition could cause a delay in therapy if the clinician is unable to start the device due to the continuous recycling and/or rebooting.,Low,2011-09-16,46.81,0,49.086
112429,"Accuro has received reports of some Apex Pumps either failing to operate or malfunctioning, at times without notifying the user of such failure or malfunction on the unit's display screen.",Low,2012-08-31,95.48,1,77.28800000000001
122228,"GE Healthcare has recently become aware of a potential safety issue involving the Avance, Avance CS2, and Aisys anesthesia devices.

While operating in Pressure Control Ventilation  Volume Guarantee (PCV-VG) mode, the affected products may produce an over delivery tidal volume when given a unique sequence of user inputs and a collapsed bellows (partially filled circuit).

Exposure to excessiv",Low,2013-09-16,92.64,0,76.584
129485,"Two (2) failures of the spring link components within the articulated arm assembly. The spring links broke during normal assembly process for the articulated arm during first cycle of the arm, prior to the 14lb tube head (full load) being installed onto the assembled articulated arm.",Low,2014-08-12,55.48,1,53.288
149530,"The infant performance test did not meet the test specification for the Infant Head Uniformity test with High Resolution.  As a result, when the user performs High Resolution head scans, the reconstructed images may exhibit degraded image quality manifested as non-uniformity of the image, CT number shift greater than 5 Hounsfield units, and reduction in gray/white matter differentiation.  The issue is most sever in the High Resolution mode, and the factory reference pediatric scan protocols are set to High Resolution default.  Adults head scans have a factory reference protocol that defaults to standard resolution which doesn't experience the issue.",Low,2016-08-24,79.6,0,68.75999999999999
157859,FDA determined that a 510(k) is needed for the Vault Mapping software (also known as Lens Fitting).,Low,2017-07-27,89.03,0,74.418
167117,Endologix is notifying physicians of patient tailored surveillance recommendations as well as general warnings/precautions for interventions to or through an existing AFX device.  This is a follow-up notification to the one that was sent out in December 2016.  The updates are related to the observation of Type III endoleaks.,Low,2018-07-31,73.31,0,64.98599999999999
173770,Device vented gas below the stated pressure.,Low,2019-06-14,71.78,0,64.068
183103,The device staples may not properly form upon application preventing adequate hemostasis.  Use of a product with this assembly error may result in incomplete staple formation.,Medium,2020-08-12,54.51,0,44.705999999999996
189108,"Ultrasound gels and lotions manufactured by Eco-Med Pharmaceutical, Inc. may contain bacterial contamination. On August 18, 2021, FDA published a Letter to Health Care Providers to further address this issue: https://www.fda.gov/medical-devices/letters-health-care-providers/stop-using-all-eco-med-ultrasound-gels-and-lotions-due-risk-bacterial-contamination-letter-health.",Medium,2021-09-07,45.59,1,38.354
195981,Potential for leakage at the catheter hub.,Medium,2022-09-01,93.83,0,68.298
202571,Stryker Neurovascular has observed that certain lots of Guider Softip XF Guide Catheters appear to have the incorrect tip curve shape. The impacted products were distributed with a tip curve shape which differs from the labeled tip curve shape.,Medium,2023-07-27,94.03,0,68.418
209749,"Sample preparation system with software may cause: 1) Multidispense feature enabled with 2-tube assay: Specimen volume dispensed into tube1 at least 3% higher than volume in tube2, or 2) Absolute counts calculated using Trucount Tubes: increased volume in tube1 may result in 20% higher absolute counts in tube 1 than tube 2; could result in additional blood collection, delayed results/patient therapy.",Medium,2024-08-12,77.99,0,58.794
29740,Mislabeled.  7mm balloon labeled 12mm,Low,2003-09-18,60.34,0,57.204
35097,Several complaints of pumps exhibiting A47 alarms were received.  Investigation revealed the alarms occurred when the pump attempted to display text that exceeded the maximum display length of the pump screen. The investigation revealed this only occurs when the pump is programmed to display information in Spanish.,Low,2004-09-14,60.95,0,57.57
41910,Software deficiency causing potential shift in absorbance readings for test results.,Low,2005-09-14,83.56,0,71.136
48343,Tibial punches were not manufactured to specification and could break at the tip during use.,Low,2006-08-29,93.83,0,77.298
55286,"Angled Insert Impactor may scratch Tibial Insert on the articulating surface, causing increased wear at the damaged site.",Low,2007-08-09,93.23,0,76.938
71820,"Some of the labels are glossy, resulting in the bar code being difficult to read by the bar code reader.",Low,2008-06-11,86.79,0,73.07400000000001
82499,"The cup associated with these lots of product may have a pin-sized hole in the floor of the cup.  As a result, there is a potential  for affected lots of cups to leak urine after an extended period of time.",Low,2009-04-27,78.52,0,68.112
94057,"Users may inadvertently leave a test plug in the inspiratory flow sensor after completing Low P Leak Check on the SCGO (Switched Common Gas Outlet) configuration of Avance, Amingo, and Aisys anesthesia machines that may impact patient safety.
If the test plug remains in place and therapy is initiated, the machine will not provide gas to the patient. This would inhibit mechanical or manual ventila",Low,2010-08-30,45.05,0,48.03
104076,Hospira has received reports of continuous recycling and/or rebooting of Plum A+ infusion pumps when the backlight intensity and/or display contrast settings for the LED display has been adjusted from the original default setting.  This condition could cause a delay in therapy if the clinician is unable to start the device due to the continuous recycling and/or rebooting.,Low,2011-09-16,49.7,0,50.82
112660,The 8 Fr. Bardex All-Silicone Foley Catheter with 3cc balloon had an incorrect inflation volume (10 ml instead of 5 ml) printed on the valve cap.,Low,2012-09-07,93.91,0,77.346
