Document_ID,Design_Input,Risk_Assessment,Last_Reviewed,Compliance_Score,Critical_Issues,Composite_Compliance_Score
30043,A minimum source-skin-distance of less than 30 cm and not identifying the tube manufacturer on the tube housing label resulted in the SP-HF-4.0 Portable Systems not complying with the U.S. Federal performance standard.,Low,2003-10-27,62.47,0,58.482
34578,Wound dressing failed to meet sterility specifications.,Low,2004-07-08,97.04,0,79.224
41815,The packaging may be compromised such that sterility of the hoods cannot be guaranteed.,Low,2005-09-13,83.92,0,71.352
46524,"Weld defect- the weld between the post body and the screw was not properly formed and can fail, even when minimal force is used.",Low,2006-05-31,75.92,1,65.55199999999999
53825,Bio-logic System Corp Camera Pole may weaken and detach at the base of the telescoping camera pole during transport causing pole to break at the welded base and fall.,Low,2007-07-26,49.36,0,50.616
74807,"An issue associated with the ""Timed Scan"" application was found.  The system does not wait for the programmed time interval and starts the x-ray after selection of the scan button when certain criteria is met.",Low,2008-04-10,49.36,0,50.616
85486,"Failure-- product can kink or ovalize, which may result in difficulty in catheter advancement or delivery of other devices and damage to catheter, which could lead to patient injury or death as a result of portions being retained in the patient.",Low,2009-09-22,43.49,3,44.094
93646,"The FDA sent a letter to Baxter on April 30, 2010, ordering the company to recall and destroy all models of its Colleague Volumetric Infusion Pumps currently in use in the United States.  FDA determined that this action is necessary, as Baxter has failed to adequately correct, within a reasonable timeframe, the deficiencies in the Colleague pumps still in use.  This recall is a consolidation of al",Low,2010-08-04,91.97,0,76.18199999999999
97591,Distal end of tactile probe may break off during use.,Low,2011-01-20,76.07,0,66.642
111690,Synthes is initiating a Medical Device Labeling Correction following a detailed review of the current labeling in response to reported complaints.  Synthes has identified technique measures and has updated the labeling associated with this system.  The labeling reflects updated technique recommendations and emphasizes the importance of avoiding rod mis-alignment.,Low,2012-06-18,82.48,0,70.488
122158,"MAQUET has identified a potential issue with the ULTIMA OPCAB (part numbers OM-2003S & OM-2001D).  Labeling for the 2 blade lots had been incorrectly applied.  The standard blades from Lot #25052176 were incorrectly labeled as deep blades, and the 20 deep blades from Lot #25052200 were incorrectly labeled as standard blades.",Low,2013-09-20,41.24,0,45.744
129828,"During production, excess metal (aluminum) debris was found stuck to the cling plastic that covers the device's pole assembly. The metallic debris could affect system performance due to the potential for a failure to power up or loss of power. This could result in the loss of monitoring and a delay in diagnosis of the patient.",Low,2014-09-08,98.19,1,78.91399999999999
139535,The company has determined the sterility cannot be assured for the affected lot.,Low,2015-07-14,89.95,0,74.97
149395,"Terumo Cardiovascular Systems (Terumo CVS) has received complaints of the CDI System 500 monitor displaying the H/S DISCONNECT AT CUVETTE error message when the CDI H/S Cuvette does not make a proper connection to the CDI H/S Probe. In this situation, blood parameter values for HCT, Hgb, and SO2 do not display.",Low,2015-12-11,52.74,0,52.644
158631,The device had an incorrect printed calibration value on the calibration certificate.,Low,2017-08-30,50.91,0,51.54599999999999
165169,"The data in the National Joint Registry of England, Wales and Northern Ireland (NJREWNI) and Australian Orthopaedic Association National Joint Replacement Registry (AOANJRR) indicate that the first generation JOURNEY BCS Knee System has a revision rate over 1.5 times the primary total knee arthroplasty device class average revision rates reported in those registries.",Medium,2018-06-13,51.0,0,42.599999999999994
175552,Potential for leaking product,Medium,2018-09-21,58.25,0,46.949999999999996
183095,The device staples may not properly form upon application preventing adequate hemostasis.  Use of a product with this assembly error may result in incomplete staple formation.,Medium,2020-08-12,71.49,0,54.894
189418,"RAPTAR units are capable of being field modified to enable the use of the higher
power visible and IR laser pointers and the IR Illuminator.",Medium,2021-04-21,65.92,0,51.552
195700,"Distribution of COVID-19 Ag Rapid Test kits in the U.S. without an Emergency Use Authorization, or a Pre-Market Approval or Clearance.",Medium,2022-08-09,57.47,0,46.482
203280,This recall has been initiated due to reports that the product code and product name were incorrectly listed on the lidstock of affected kits.,Medium,2023-08-10,76.71,0,58.025999999999996
209491,"Insulin pumps that have been dropped, bumped, or experienced physical impact may have damage to internal electrical components, which may cause reduced pump battery life. Since the defect reduces the battery life overall, it shortens the time between low battery alarms and increases the frequency with which the user must insert a new battery. Further, the defect may also deliver the low battery alarm when there is significantly less time before the battery completely runs out, from the expected up to 10-hour buffer the low alert is supposed to signal, leading to device powering down and stopping insulin delivery unexpectedly. Per the firm, a subset of pumps with the defect showed the low alert alarm was delivered ~2.5 hours before the device shut off, however, patient reports indicate the time could be even shorter. Replacing the battery will not resolve this issue and the short battery life and the truncated low battery alert lead time will continue to occur. Early battery depletion could result in power loss and insulin delivery could be interrupted, resulting in under delivery of insulin potentially leading to hyperglycemia and/or DKA.",Medium,2024-07-31,48.37,1,40.022
29801,Product intended for distribution outside USA was distributed without premarket notification requirements being met.,Low,2003-08-20,57.53,0,55.518
34618,Device can generate overestimated platelet results.,Low,2004-08-13,61.98,0,58.187999999999995
42122,The packaging may be compromised such that sterility of the hoods cannot be guaranteed.,Low,2005-09-13,67.36,0,61.416
46588,Final software load did not occur prior to shipment of select programmers.,Low,2006-05-19,87.11,0,73.26599999999999
53495,Pressure (from recapped tubes) or vacuum (from under-filled short-draw tubes) will cause inaccurate results if not properly vented.,Low,2007-02-22,51.98,0,52.187999999999995
84800,"GE Healthcare has recently become aware of a potential risk of observing a blank image after exposure on
Revolution XR/d systems equipped with HP 8200 PC user consoles that may impact patient safety.

It was reported that images acquired with off-center collimation for extremities with the
position selected as Digits to front or Digits to back are displayed as blank. Investigation into
th",Low,2008-02-14,70.85,0,63.51
84106,Several complaints were the two parts of the tubular package became loose under the shrink wrap that holds the DFU on the packaging tube.,Low,2009-06-22,75.54,0,66.32400000000001
93647,"The FDA sent a letter to Baxter on April 30, 2010, ordering the company to recall and destroy all models of its Colleague Volumetric Infusion Pumps currently in use in the United States.  FDA determined that this action is necessary, as Baxter has failed to adequately correct, within a reasonable timeframe, the deficiencies in the Colleague pumps still in use.  This recall is a consolidation of al",Low,2010-08-04,42.79,0,46.674
97818,Distal end of tactile probe may break off during use.,Low,2011-01-20,76.45,0,66.87
112657,The recall was initiated because Beckman Coulter has confirmed that the Coulter PrepPlus may experience intermittant reagent level sense failures where the instrument may not produce a warning that a reagent vial is low or out of reagent.,Low,2012-01-20,50.23,1,50.138
121688,"On December 13, 2012, King Systems initiated a voluntary recall of one (1) case(s) (5) individual products) from one (1) lot [(IV1V3) 62 cases, 310 products]of King LTSD Oropharyngeal Airways because the package label indicated that the airway was a size 5 when in fact the airway in the package was a size 4. When King manufacturers a lot, all of the components are the same size, part number etc. I",Low,0012-12-13,43.9,0,47.34
130113,"Two malfunctions posing potential risk to patients were identified with Siemens Ysio Max, AXIOM Luminos dRF Max, Uroskop Omnia Max, and Luminos Agile Max systems with a specific set of serial numbers that will cause lost images due to an automatic Radiology Information System (RIS) worklist update, thus causing examinations to be repeated. Image label may also be displayed incorrectly after images",Low,2014-09-02,96.93,0,79.158
140077,Image disappeared from the cardiac ultrasound system when the CARTO 3 EP Navigation System needed restarting while the patient was experiencing pericardial effusion.  Affects the CARTOSOUND Module of the CARTO 3 EP Navigation System when used with the SOUNDSTAR eco 8F and 10F Diagnostic Ultrasound Catheters. New precautions added.,Low,2015-09-10,97.94,0,79.764
149424,"Merit Medical Systems, Inc. announces a voluntary field action for Merit Inflation Syring Kit due to unit labels missing required device labeling information.",Low,2016-08-25,88.5,0,74.1
158557,The high control for the kit is recovering low and may be out of range for assigned values.,Low,2017-08-23,58.28,0,55.967999999999996
165170,"The data in the National Joint Registry of England, Wales and Northern Ireland (NJREWNI) and Australian Orthopaedic Association National Joint Replacement Registry (AOANJRR) indicate that the first generation JOURNEY BCS Knee System has a revision rate over 1.5 times the primary total knee arthroplasty device class average revision rates reported in those registries.",Medium,2018-06-13,45.86,0,39.516
176398,Potential for leaking product,Medium,2018-09-21,81.05,0,60.629999999999995
183096,The device staples may not properly form upon application preventing adequate hemostasis.  Use of a product with this assembly error may result in incomplete staple formation.,Medium,2020-08-12,66.41,0,51.846
188744,Potential for needle protector to become fully dislodge exposing infusion needle which could result in needle stick.,Medium,2021-07-27,47.32,0,40.391999999999996
196036,"The display screen may become frozen and unresponsive to user input, triggering an alarm that is evidenced by a buzzer sound and flashing red LEDs as a secondary notification. However, as the screen goes blank it does not indicate an alarm condition or respond. This issue leads to temporary cessation of flow of a medication or fluid, requiring immediate intervention by the clinician.",Low,2022-09-08,69.71,0,62.82599999999999
203281,This recall has been initiated due to reports that the product code and product name were incorrectly listed on the lidstock of affected kits.,Medium,2023-08-10,42.06,0,37.236000000000004
209613,"Insulin pumps that have been dropped, bumped, or experienced physical impact may have damage to internal electrical components, which may cause reduced pump battery life. Since the defect reduces the battery life overall, it shortens the time between low battery alarms and increases the frequency with which the user must insert a new battery. Further, the defect may also deliver the low battery alarm when there is significantly less time before the battery completely runs out, from the expected up to 10-hour buffer the low alert is supposed to signal, leading to device powering down and stopping insulin delivery unexpectedly. Per the firm, a subset of pumps with the defect showed the low alert alarm was delivered ~2.5 hours before the device shut off, however, patient reports indicate the time could be even shorter. Replacing the battery will not resolve this issue and the short battery life and the truncated low battery alert lead time will continue to occur. Early battery depletion could result in power loss and insulin delivery could be interrupted, resulting in under delivery of insulin potentially leading to hyperglycemia and/or DKA.",Medium,2024-07-31,94.56,1,67.73599999999999
26623,The correct individual insulin syringe labeling size and guage may be different than what is on the incorrectly labeled shelf box .,Low,2003-02-24,55.53,0,54.318
34628,Device can generate overestimated platelet results.,Low,2004-08-13,79.75,0,68.85
42138,package sealing defect - product may not be sterile,Low,2005-09-15,58.7,1,55.22
47623,The preservative sodium azide used in the Kit Negative Control (part number FCOM175) was at the wrong concentration - the Kit Negative Control contains 0.2% sodium azide rather than the intended 0.1%.,Low,2005-11-11,71.2,0,63.72
53649,"Diagnostic test kit for Helicobacter pylori was distributed for adult and pediatric use, but was not approved for pediatric use.",Low,2007-05-02,72.8,0,64.68
84808,"GE Healthcare has recently become aware of an error in the generator software on the Revolution XR/d
configured with HP 8200 PC consoles that reports a mAs reading that is higher than is actually exposed to patients.",Low,2008-02-14,51.09,0,51.653999999999996
84415,"incorrect default configuration settings, insufficient
battery power as the user may not be alerted that no battery is installed or that a low battery condition exists prior to disconnecting from AC or DC power",Low,2009-08-21,98.18,0,79.908
93546,The BladderScan BVI 9600 with AortaScan devices may experience the loss of a factory installed software configuration file which results in a loss of the aorta measurement function.,Low,2010-08-23,86.51,0,72.906
104183,Cochlear implant may shut down and cease to function.,Low,2011-09-16,96.37,0,78.822
112693,"The recall was initiated because Beckman Coulter has confirmed customer reports of QC shifts, lot-to-lot variation, and an increase in the percent of patient samples recovering >20 IU/mL using the Lots# M012376 and M101865 of IMMAGE RF reagent.  The lots identified for the RF reagent might produce false abnormal results.",Low,2012-01-27,93.69,0,77.214
121288,Due to a labeling error related to the conversion of the inner diameter of the catheter from inches to millimeters.  The English dimension is correct and is the primary dimension.,Low,2013-08-12,75.87,0,66.52199999999999
130370,"Two malfunctions posing potential risk to patients were identified with Siemens Ysio Max, AXIOM Luminos dRF Max, Uroskop Omnia Max, and Luminos Agile Max systems with a specific set of serial numbers that will cause lost images due to an automatic Radiology Information System (RIS) worklist update, thus causing examinations to be repeated. Image label may also be displayed incorrectly after images",Low,2014-09-02,95.31,0,78.186
140078,Image disappeared from the cardiac ultrasound system when the CARTO 3 EP Navigation System needed restarting while the patient was experiencing pericardial effusion.  Affects the CARTOSOUND Module of the CARTO 3 EP Navigation System when used with the SOUNDSTAR eco 8F and 10F Diagnostic Ultrasound Catheters. New precautions added.,Low,2015-09-10,45.31,0,48.186
149732,"The drill bit used to drill the hex pre-drilled hole in the screw head of the Tibial Augment Bolts included in the Vanguard 360 Revision Knee System was larger than allowable per the process specification.  As a result, the hex geometry can still be visible, but there are radial cuts into the hex flat. Therefore, when the bolt is inserted into the augment, the screwdriver is unable to catch on the hex geometry, or the screwdriver strips the remaining hex geometry, and the bolt is unable to be fully tightened.

The bolt stripping or the bolt not being fully tightened will be noticed by the surgeon intraoperatively when he or she is unable to screw the augment bolts into the augment. This possible event can result in an intraoperative delay resulting in increased time under anesthesia.",Low,2016-08-08,51.76,0,52.056
158602,The device may exhibit premature battery depletion.,Low,2017-08-28,42.71,0,46.626000000000005
165171,"The data in the National Joint Registry of England, Wales and Northern Ireland (NJREWNI) and Australian Orthopaedic Association National Joint Replacement Registry (AOANJRR) indicate that the first generation JOURNEY BCS Knee System has a revision rate over 1.5 times the primary total knee arthroplasty device class average revision rates reported in those registries.",Medium,2018-06-13,59.52,0,47.712
176399,Potential for leaking product,Medium,2018-09-21,63.32,0,49.992
183097,The device staples may not properly form upon application preventing adequate hemostasis.  Use of a product with this assembly error may result in incomplete staple formation.,Medium,2020-08-12,56.28,0,45.768
189291,There was a label mix-up between two model numbers resulting in the incorrect guidewire being contained in the kits for both model numbers.,Medium,2021-09-13,89.72,0,65.832
196079,Excessive ultraviolet-C radiation,Medium,2022-01-27,61.41,0,48.846
203282,This recall has been initiated due to reports that the product code and product name were incorrectly listed on the lidstock of affected kits.,Medium,2023-08-10,56.86,0,46.116
209614,"Insulin pumps that have been dropped, bumped, or experienced physical impact may have damage to internal electrical components, which may cause reduced pump battery life. Since the defect reduces the battery life overall, it shortens the time between low battery alarms and increases the frequency with which the user must insert a new battery. Further, the defect may also deliver the low battery alarm when there is significantly less time before the battery completely runs out, from the expected up to 10-hour buffer the low alert is supposed to signal, leading to device powering down and stopping insulin delivery unexpectedly. Per the firm, a subset of pumps with the defect showed the low alert alarm was delivered ~2.5 hours before the device shut off, however, patient reports indicate the time could be even shorter. Replacing the battery will not resolve this issue and the short battery life and the truncated low battery alert lead time will continue to occur. Early battery depletion could result in power loss and insulin delivery could be interrupted, resulting in under delivery of insulin potentially leading to hyperglycemia and/or DKA.",Medium,2024-07-31,72.56,1,54.536
26624,The correct individual insulin syringe labeling size and guage may be different than what is on the incorrectly labeled shelf box .,Low,2003-02-24,48.46,0,50.076
34793,The device has a potential risk of failure caused by faulty wiring within the electrical component.  The wires can overheat and eventually break in two.,Low,2004-09-03,88.13,1,72.87799999999999
40482,Some hard shell carry case for  LIFEPAK 500 and LIFEPAK CR Plus automated external defibrillators may have blocked pressure vent which may make it difficult to open the case after a sudden decrease in altitude (such as in aircraft landng or mountain descent).,Low,2005-07-12,44.47,0,47.682
48148,Sticky Valve Disk- The valve disk has an increased tendency to stick during operation causing noise and pressure/vacuum alarms.,Low,2006-08-25,99.21,0,80.526
53791,Tip of PathFinder surgical instrument broke during procedure.,Low,2007-07-18,86.33,0,72.798
73274,"Products exceed inaccuracy threshold , with many complaints resulting from inaccurate low results.",Low,2008-09-19,51.92,0,52.152
85632,A software defect - may result in a false indication and warning on the OEC 9900 Workstation and C-arm display that the X-Ray tube Anode is over-heated.  This will also cause the displayed air kerma rate and cumulative air kerma to be inaccurate.,Low,2009-08-12,40.33,1,44.19799999999999
93548,The AortaScan AMI 9700 devices may experience the loss of a factory installed software configuration file which results in a loss of the aorta measurement function.,Low,2010-08-23,88.93,0,74.358
100377,"Reports of non-delivery/ significant under-delivery of fluids when the CADD Medication Cassette Reservoir is not correctly latched to the pump.

EXPANDED:  On 7/14/11, Smith Medical expanded this recall to include all consignees with affected pumps.",Low,2011-05-10,82.41,0,70.446
113089,"The firm initiated the product recall because labeling on some of the intermediate boxes of catheters identify the contents to be M16C, a coud-tip catheters while the actual contents are M16Fr male, 16Fr, straight-tip catheters with the pouch and the case box labeled as M16Fr male, 16Fr, straight-tip catheters.",Low,2012-09-19,83.74,0,71.244
122141,No antibacterial bandages were packed in boxes labeled as antibacterial.,Low,2013-08-21,86.28,0,72.768
130371,"Two malfunctions posing potential risk to patients were identified with Siemens Ysio Max, AXIOM Luminos dRF Max, Uroskop Omnia Max, and Luminos Agile Max systems with a specific set of serial numbers that will cause lost images due to an automatic Radiology Information System (RIS) worklist update, thus causing examinations to be repeated. Image label may also be displayed incorrectly after images",Low,2014-09-02,44.44,0,47.664
139235,Irregular battery disconnection resulted in issues with Mobile Health Button (MHB) Charging.,Low,2015-07-23,61.51,0,57.906
149595,"There is a risk that defibrillation electrodes model DF29N will be connected with the defibrillator Welch Allyn AED 10 only with delay or not at all.  This may cause a situation in which a patient, who is in a life threatening condition and requires a
defibrillation shock, cannot be treated in good time.",Low,2016-09-01,46.95,0,49.17
158629,The device may exhibit premature battery depletion.,Low,2017-08-28,91.79,0,76.07400000000001
167222,Reports have been received of an anomaly that can result in a treatment without intended gating (respiratory tracking/monitoring). This issue occurs when a patient planned with gating is treated on more than one system.,Low,2018-08-20,77.4,0,67.44
176400,Potential for leaking product,Medium,2018-09-21,59.85,0,47.91
183098,The device staples may not properly form upon application preventing adequate hemostasis.  Use of a product with this assembly error may result in incomplete staple formation.,Medium,2020-08-12,43.81,0,38.286
189113,There is a potential for false positive results.,Low,2021-09-02,58.66,0,56.196
196075,Device may intermittently fail to produce audio. Turning the unit off and on does not resolve the issue; disconnecting and reconnecting to AC power does not reliably resolve the issue.,Medium,2022-09-06,59.51,0,47.705999999999996
203283,This recall has been initiated due to reports that the product code and product name were incorrectly listed on the lidstock of affected kits.,Medium,2023-08-10,83.78,0,62.268
209941,Manual resuscitator circuit flow controller may come apart due to a missing manufacturing step.,Medium,2024-08-30,78.25,0,58.949999999999996
26625,The correct individual insulin syringe labeling size and guage may be different than what is on the incorrectly labeled shelf box .,Low,2003-02-24,93.23,0,76.938
34888,Product is mislabeled as a Mushroom Cap Vacuum but actually contains a Bell Style Assisted Delivery System,Low,2004-08-17,68.33,0,61.998
40483,Some hard shell carry case for  LIFEPAK 500 and LIFEPAK CR Plus automated external defibrillators may have blocked pressure vent which may make it difficult to open the case after a sudden decrease in altitude (such as in aircraft landng or mountain descent).,Low,2005-07-12,47.18,0,49.308
48199,"A component of the device is a Dell laptop computer, which contains batteries that are under recall because they can overheat and cause a fire.",Low,2006-09-08,82.79,0,70.674
53792,Tip of PathFinder surgical instrument broke during procedure.,Low,2007-07-18,85.65,0,72.39
85541,"Audible signal is not available at all times when using the HLC fluoroscopy mode.  Special means of activation are not designed in for selection of High Level Controls, as required by regulation.",Low,2008-09-29,73.68,0,65.208
85633,A software defect - may result in a false indication and warning on the OEC 9900 Workstation and C-arm display that the X-Ray tube Anode is over-heated.  This will also cause the displayed air kerma rate and cumulative air kerma to be inaccurate.,Low,2009-08-12,86.26,1,71.756
93550,The BladderScan BVM 9500 devices may experience the loss of a factory installed software configuration file which results in a loss of the aorta measurement function.,Low,2010-08-23,69.63,0,62.778
101351,An investigation was initiated based on a report from the field in which an Intensive Follow-up Indicator (IFI) message was unexpectedly received by a medical professional when using Model 250 version 8.0 software to interrogate a patient's Model 103 Generator.,Low,2011-05-06,71.36,0,63.815999999999995
109065,Wear of the keypad that may lead to damage such as tearing or peeling of the edge of the keypad from the pump.,Low,2012-07-16,65.65,0,60.39
116171,"Firm became aware that some products within the specified lot may not have been sealed appropriately, thus compromising the sterile barrier.",Low,2013-01-04,41.53,0,45.918
